{
  "project": "精品书吧 Boutique Book Cafe · v1",
  "slug": "22-boutique-book-cafe",
  "client": "独立主理人 · 文艺爱好者 / 小众咖啡玩家",
  "business_model": "第三空间 · 手冲咖啡 + 慢阅读 + 小型读书会（周末午后 + 晚场 19:00-22:00）",
  "space": {
    "type": "街角商铺改造",
    "area_sqm": 60,
    "n_floors": 1,
    "dimensions_m": {"length": 10.0, "width": 6.0, "height": 3.2},
    "frontage_m": 6.0,
    "existing_condition": "基础砖墙 · 临街带 3 面窗 · 独立出入口 · 无中柱"
  },
  "style": {
    "keywords": ["warm-wood", "literary-cozy", "japandi-nordic", "soft-reading-light", "plant-accent"],
    "palette": {
      "wood_oak":     "#9B7B5A",
      "cream_wall":   "#F5EFE4",
      "deep_green":   "#3A5C44",
      "warm_brass":   "#C9A86A",
      "soft_black":   "#3A3A3A",
      "fabric_beige": "#D4C4A8"
    },
    "reference_brands": ["蔦屋書店 Tsutaya T-Site", "言几又", "Fuglen Coffee", "% Arabica"]
  },
  "functional_zones": [
    {"name": "入口 / 接待", "area_m2": 4, "key_objects": ["落地木门", "木质地垫", "小型衣帽架"]},
    {"name": "吧台 / 点单", "area_m2": 9, "key_objects": ["直线吧台 3m", "单头手冲台", "小型意式咖啡机", "后吧展示架 2 层"]},
    {"name": "长桌阅读区", "area_m2": 14, "key_objects": ["1 × 3.5m 长木桌", "6 × 木椅配软座垫", "桌面可充电插座"]},
    {"name": "沙发散座区", "area_m2": 11, "key_objects": ["2 × 双人布艺沙发", "2 × 单人扶手椅", "2 × 小茶几"]},
    {"name": "书架墙", "area_m2": 0, "key_objects": ["整面 6m × 2.8m 通高木书架 · 5 层混合展示 / 收纳"]},
    {"name": "后吧 / 备餐", "area_m2": 7, "key_objects": ["操作台", "小水槽", "小冰柜", "开水器"]},
    {"name": "卫生间", "area_m2": 3, "key_objects": ["单间卫生间 · 洗手台"]},
    {"name": "绿植点缀", "area_m2": 2, "key_objects": ["2 × 落地大型绿植（Monstera / 橄榄树）"]}
  ],
  "lighting": {
    "main": "5 × 黄铜吊灯（Menu TR Bulb 同类）沿长桌和吧台上方",
    "accent": "书架每层嵌入线性灯带 2700K · 阅读桌面筒射 3000K",
    "daylight": "临街 3 面窗提供早午主要采光（木百叶可调）",
    "warmth": "2700-3000 K"
  },
  "budget_hkd": 600000,
  "budget_rmb": 560000,
  "timeline_weeks": 10,
  "must_have": [
    "一面完整 6m 通高木书架墙，作为视觉主轴",
    "至少 12 个稳定座位（长桌 6 + 沙发 6）",
    "吧台后工作流线独立、与顾客动线不交叉",
    "入口不阻塞阅读区，读书会时可拉出临时椅增加 6-8 座",
    "2700-3000K 暖色温全局 + 书架可点亮型灯带",
    "临街窗保留日光 + 木百叶可调私密性",
    "符合 HK BEEO 2021 餐饮零售能耗规范"
  ],
  "compliance": {
    "target_code": "HK",
    "primary_concerns": ["餐饮类 EUI 限值", "照明功率密度 W/m²", "窗墙比 + SHGC"]
  }
}
